466,"Shayne Graham, Hou K",0/0,0,0,0,0,0,0,0,0,0,0
467,"Zach Miller, Sea TE  Q",0/0,0,0,0,0,0,0,39,413,3,59
468,"Mike Kafka, Phi QB  Q",0/0,0,0,0,0,0,0,0,0,0,0
469,"Caleb Hanie, Den QB",0/0,0,0,0,0,0,0,0,0,0,0
470,"David Carr, NYG QB",0/0,0,0,0,0,0,0,0,0,0,0
471,Panthers D/ST D/ST,0/0,0,0,0,0,0,0,0,0,0,86
472,"Orson Charles, Cin TE",0/0,0,0,0,0,0,0,0,0,0,0
473,"Derek Anderson, Car QB",0/0,0,0,0,0,0,0,0,0,0,0
474,"Kellen Clemens, StL QB",0/0,0,0,0,0,0,0,0,0,0,0
475,"Earnest Graham, FA RB",0/0,0,0,0,0,0,0,0,0,0,0
476,"Anthony Gonzalez, FA WR",0/0,0,0,0,0,0,0,0,0,0,0
477,"D.J. Williams, GB TE  P",0/0,0,0,0,0,0,0,0,0,0,0
478,"Chris Redman, Atl QB",0/0,0,0,0,0,0,0,0,0,0,0
479,"Tyrod Taylor, Bal QB",0/0,0,0,0,0,0,0,0,0,0,0
480,"Bruce Gradkowski, Cin QB",0/0,0,0,0,0,0,0,0,0,0,0
481,"Drew Stanton, Ind QB",0/0,0,0,0,0,0,0,0,0,0,0
482,"Evan Rodriguez, Chi TE",0/0,0,0,0,0,0,0,0,0,0,0
483,Colts D/ST D/ST,0/0,0,0,0,0,0,0,0,0,0,65
484,"Ryan Longwell, FA K",0/0,0,0,0,0,0,0,0,0,0,0
485,"Chester Taylor, FA RB",0/0,0,0,0,0,0,0,0,0,0,0
486,"Matt Willis, Den WR",0/0,0,0,0,0,0,0,0,0,0,0
487,"Colin Kaepernick, SF QB",0/0,0,0,0,0,0,0,0,0,0,0
488,"Russell Wilson, Sea QB",0/0,0,0,0,0,0,0,0,0,0,0
489,"Jeff King, Ari TE  P",0/0,0,0,0,0,0,0,0,0,0,0
490,"Stephen McGee, Dal QB",0/0,0,0,0,0,0,0,0,0,0,0
491,"Ryan Mallett, NE QB",0/0,0,0,0,0,0,0,0,0,0,0
492,"Seneca Wallace, Cle QB",0/0,0,0,0,0,0,0,0,0,0,0
493,"Dante Rosario, SD TE",0/0,0,0,0,0,0,0,0,0,0,0
494,"Terrelle Pryor, Oak QB",0/0,0,0,0,0,0,0,0,0,0,0
495,"Kirk Cousins, Wsh QB",0/0,0,0,0,0,0,0,0,0,0,0
496,"Brock Osweiler, Den QB",0/0,0,0,0,0,0,0,0,0,0,0
497,"B.J. Coleman, GB QB",0/0,0,0,0,0,0,0,0,0,0,0
498,"Jerome Harrison*, FA RB  O",0/0,0,0,0,0,0,0,0,0,0,0
499,"Taylor Price*, Jac WR  O",0/0,0,0,0,0,0,0,0,0,0,0
500,"Andrew Quarless*, GB TE  O",0/0,0,0,0,0,0,0,0,0,0,0
